{
  "$schema": "http://json-schema.org/draft-07/schema#",
  "title": "Invoice",
  "type": "object",
  "required": ["vendor_name", "invoice_number", "invoice_date", "currency", "line_items", "subtotal", "total"],
  "properties": {
    "vendor_name": { "type": ["string", "null"] },
    "vendor_tax_id": { "type": ["string", "null"] },
    "invoice_number": { "type": ["string", "null"] },
    "invoice_date": { "type": ["string", "null"] },
    "due_date": { "type": ["string", "null"] },
    "currency": { "type": ["string", "null"] },
    "line_items": {
      "type": "array",
      "items": {
        "type": "object",
        "required": ["description", "quantity", "unit_price", "amount"],
        "properties": {
          "description": { "type": ["string", "null"] },
          "quantity": { "type": ["number", "null"] },
          "unit_price": { "type": ["number", "null"] },
          "amount": { "type": ["number", "null"] }
        }
      }
    },
    "subtotal": { "type": ["number", "null"] },
    "tax_total": { "type": ["number", "null"] },
    "discount_total": { "type": ["number", "null"] },
    "total": { "type": ["number", "null"] }
  }
}
